{
  "$schema": "../../../schemas/page.schema.json",
  "slug": "eberron/khorvaire/tierras-enlutadas",
  "title": "Tierras Enlutadas",
  "tags": ["Khorvaire", "Tierras Enlutadas", "Cyre", "Cataclismo"],
  "aliases": ["Tierras Enlutadas"],
  "unlockCondition": null,
  "blocks": [
    {
      "id": "a2",
      "type": "text",
      "content": "Lo que antes era Cyre, la joya cultural de Khorvaire, ahora es un desierto gris y místico debido al cataclismo que puso fin a la guerra (El Día del Luto). Una densa niebla muerta rodea la frontera. En su interior, la magia funciona mal, los cuerpos no se descomponen y los monstruos mutados vagan por ciudades congeladas en el tiempo. Es el lugar más peligroso del mundo, pero lleno de tesoros perdidos.",
      "title": "El Cadáver de una Nación"
    },
    {
      "id": "i1",
      "type": "info",
      "variant": "lore",
      "content": "Probablemente el Luto fue provocado por un experimento fallido de los gobernantes para intentar ganar la guerra. ¿O fue la Casa Cannith? Casualmente la cúpula Phiarlan no estaba allí cuando ocurrió..."
    },
    {
      "id": "a3",
      "type": "image",
      "src": "/assets/content/eberron/khorvaire/tierras-enlutadas/tierras-enlutadas.png",
      "caption": "Tierras Enlutadas",
      "title": "Tierras Enlutadas",
      "align": "center",
      "size": "full"
    },
    {
      "id": "a4",
      "type": "related",
      "items": [
        {
          "label": "Cinco Naciones",
          "slug": "eberron/khorvaire/cinco-naciones"
        },
        {
          "label": "Aundair",
          "slug": "eberron/khorvaire/aundair"
        },
        {
          "label": "Baluartes de Mror",
          "slug": "eberron/khorvaire/baluartes"
        },
        {
          "label": "Breland",
          "slug": "eberron/khorvaire/breland"
        },
        {
          "label": "Confines de Eldeen",
          "slug": "eberron/khorvaire/confines-eldeen"
        },
        {
          "label": "Darguun",
          "slug": "eberron/khorvaire/darguun"
        },
        {
          "label": "Droaam",
          "slug": "eberron/khorvaire/droaam"
        },
        {
          "label": "Karrnath",
          "slug": "eberron/khorvaire/karrnath"
        },
        {
          "label": "Llanuras de Talenta",
          "slug": "eberron/khorvaire/llanuras-talenta"
        },
        {
          "label": "Las Marcas Sombrias",
          "slug": "eberron/khorvaire/marcas-sombrias"
        },
        {
          "label": "Principados de Lhazaar",
          "slug": "eberron/khorvaire/principados-lhazaar"
        },
        {
          "label": "Q'barra",
          "slug": "eberron/khorvaire/qbarra"
        },
        {
          "label": "Thrane",
          "slug": "eberron/khorvaire/thrane"
        },
        {
          "label": "Tierras Enlutadas",
          "slug": "eberron/khorvaire/tierras-enlutadas"
        },
        {
          "label": "Valenar",
          "slug": "eberron/khorvaire/valenar"
        },
        {
          "label": "Yermos Demoníacos",
          "slug": "eberron/khorvaire/yermos-demoniacos"
        },
        {
          "label": "Zilargo",
          "slug": "eberron/khorvaire/zilargo"
        }
      ]
    }
  ]
}
