{
  "$schema": "../../../schemas/page.schema.json",
  "slug": "eberron/antagonistas/sonadores",
  "title": "La Oscuridad onírica",
  "tags": ["Antagonistas", "Soñadores", "Dal Quor", "Quori"],
  "aliases": ["Soñadores"],
  "unlockCondition": null,
  "blocks": [
    {
      "id": "a0",
      "type": "text",
      "content": "El brazo de espionaje psíquico e infiltración de los Quori (espíritus alienígenas de las pesadillas que gobiernan el continente de [[eberron/mas-alla/sarlona|Sarlona]])."
    },
    {
      "id": "a1",
      "type": "text",
      "content": "Buscan estabilizar su control mental sobre el plano material. Mientras que en [[eberron/mas-alla/sarlona|Sarlona]] gobiernan abiertamente, en [[eberron/khorvaire|Khorvaire]] actúan a través de agentes poseídos en secreto, psiónicos y asesinos de mentes. Buscan desestabilizar las naciones de Khorvaire mediante la paranoia, el sabotaje y las pesadillas para que, eventualmente, la población clame por el 'orden' que ofrece su Imperio."
    },
    {
      "id": "a2",
      "type": "image",
      "src": "/assets/content/eberron/antagonistas/oscuridad-onirica/sonadores.png",
      "caption": "La Oscuridad onírica",
      "title": "La Oscuridad onírica",
      "align": "center",
      "size": "medium"
    },
    {
      "id": "a3",
      "type": "related",
      "items": [
        { "label": "Orden de la Garra Esmeralda", "slug": "eberron/antagonistas/garra-esmeralda" },
        { "label": "Señores del Polvo", "slug": "eberron/antagonistas/polvo" },
        { "label": "La Oscuridad onírica", "slug": "eberron/antagonistas/oscuridad-onirica" },
        { "label": "Daelkyr y Cultos de la Locura", "slug": "eberron/antagonistas/daelkyr" },
        { "label": "Fideicomiso de Zilargo", "slug": "eberron/antagonistas/fideicomiso" },
        { "label": "El Señor de los Filos", "slug": "eberron/antagonistas/filos" }
      ]
    }
  ]
}
