{
  "$schema": "../../../schemas/page.schema.json",
  "slug": "eberron/khorvaire/thrane",
  "title": "Thrane",
  "tags": ["Khorvaire", "Thrane", "Teocracia"],
  "aliases": ["Thrane"],
  "unlockCondition": null,
  "blocks": [
    {
      "id": "a1",
      "type": "text",
      "content": "La Teocracia de la Llama Plata"
    },
    {
      "id": "a2",
      "type": "text",
      "content": "Una nación gobernada por la iglesia de la Llama Plata, una fuerza divina de luz que protege al mundo del mal. El poder político reside en el Consejo de Cardenales y la Joven Guardiana de la Llama, Jaela Daran (una niña de 11 años con poderes divinos). Es un lugar limpio, seguro y ultra-religioso, pero donde la intolerancia hacia lo 'impuro' o lo arcano roza el fanatismo."
    },

    {
      "id": "a3",
      "type": "image",
      "src": "/assets/content/eberron/khorvaire/thrane/thrane.png",
      "caption": "Thrane",
      "title": "Thrane",
      "align": "center",
      "size": "full"
    },
    {
      "id": "a4",
      "type": "related",
      "items": [
        { "label": "Cinco Naciones", "slug": "eberron/khorvaire/cinco-naciones" },
        { "label": "Aundair", "slug": "eberron/khorvaire/aundair" },
        { "label": "Baluartes de Mror", "slug": "eberron/khorvaire/baluartes" },
        { "label": "Breland", "slug": "eberron/khorvaire/breland" },
        { "label": "Confines de Eldeen", "slug": "eberron/khorvaire/confines-eldeen" },
        { "label": "Darguun", "slug": "eberron/khorvaire/darguun" },
        { "label": "Droaam", "slug": "eberron/khorvaire/droaam" },
        { "label": "Karrnath", "slug": "eberron/khorvaire/karrnath" },
        { "label": "Llanuras de Talenta", "slug": "eberron/khorvaire/llanuras-talenta" },
        { "label": "Las Marcas Sombrias", "slug": "eberron/khorvaire/marcas-sombrias" },
        { "label": "Principados-Lhazaar", "slug": "eberron/khorvaire/principados-lhazaar" },
        { "label": "Q'barra", "slug": "eberron/khorvaire/qbarra" },
        { "label": "Thrane", "slug": "eberron/khorvaire/thrane" },
        { "label": "Tierras Enlutadas", "slug": "eberron/khorvaire/tierras-enlutadas" },
        { "label": "Valenar", "slug": "eberron/khorvaire/valenar" },
        { "label": "Yermos Demoníacos", "slug": "eberron/khorvaire/yermos-demoniacos" },
        { "label": "Zilargo", "slug": "eberron/khorvaire/zilargo" }
      ]
    }
  ]
}
