{
  "$schema": "../../../../../schemas/page.schema.json",
  "slug": "eberron/khorvaire/breland/sharn/barrios",
  "title": "Barrios de Sharn",
  "tags": ["Sharn", "Barrios"],
  "aliases": ["Sharn", "Horizontal"],
  "unlockCondition": null,
  "blocks": [
    {
      "id": "a1",
      "type": "image",
      "src": "/assets/content/eberron/khorvaire/breland/sharn/barrios/sharn-horizontal.jpg",
      "caption": "Barrios de Sharn",
      "title": "Barrios de Sharn",
      "align": "center",
      "size": "full"
    },
    {
      "id": "a4",
      "type": "related",
      "items": [
        {
          "label": "Mapa de Sharn",
          "slug": "eberron/khorvaire/breland/sharn/barrios"
        },
        {
          "label": "Vía Celestial",
          "slug": "eberron/khorvaire/breland/sharn/barrios/via-celestial"
        },
        {
          "label": "Barrios Altos",
          "slug": "eberron/khorvaire/breland/sharn/barrios/barrios-altos"
        },
        {
          "label": "Barrios Medios",
          "slug": "eberron/khorvaire/breland/sharn/barrios/barrios-medios"
        },
        {
          "label": "Barrios Bajos",
          "slug": "eberron/khorvaire/breland/sharn/barrios/barrios-bajos"
        },
        {
          "label": "Los Engranajes",
          "slug": "eberron/khorvaire/breland/sharn/barrios/engranajes"
        }
      ]
    }
  ]
}
