{
  "$schema": "../../../schemas/page.schema.json",
  "slug": "eberron/planos/dal-quor",
  "title": "Dal Quor",
  "tags": ["Cosmología", "Planos", "Sueños"],
  "aliases": ["Daanvi", "La Región de los Sueños"],
  "unlockCondition": null,
  "blocks": [
    {
      "id": "d1",
      "type": "text",
      "content": " Cada vez que una mente mortal duerme, su espíritu viaja aquí para dar forma a su propio sueño efímero. El centro del plano, sin embargo, es una masa de oscuridad perpetua gobernada por los Quori, los monstruos psiónicos que controlan el Imperio de Riedra en Sarlona."
    },
    {
      "id": "d11",
      "type": "info",
      "variant": "lore",
      "content": " Dal Quor está permanentemente remoto desde que los gigantes destruyeron su conexión hace milenios; ya no se puede viajar físicamente allí, solo soñando."
    },
    {
      "id": "d2",
      "type": "image",
      "src": "/assets/content/eberron/planos/dal-quor/dalquor.png",
      "caption": "Dal Quor",
      "title": "Dal Quor",
      "align": "center",
      "size": "medium"
    },
    {
      "id": "d3",
      "type": "related",
      "items": [
        { "label": "Planos", "slug": "eberron/planos" },
        { "label": "Daanvi", "slug": "eberron/planos/daanvi" },
        { "label": "Dal Quor", "slug": "eberron/planos/dal-quor" },
        { "label": "Dolurrh", "slug": "eberron/planos/dolurrh" },
        { "label": "Fernia", "slug": "eberron/planos/fernia" },
        { "label": "Irian", "slug": "eberron/planos/irian" },
        { "label": "Kythri", "slug": "eberron/planos/kythri" },
        { "label": "Lamannia", "slug": "eberron/planos/lamannia" },
        { "label": "Mabar", "slug": "eberron/planos/mabar" },
        { "label": "Risia", "slug": "eberron/planos/risia" },
        { "label": "Shavarath", "slug": "eberron/planos/shavarath" },
        { "label": "Thelanis", "slug": "eberron/planos/thelanis" },
        { "label": "Xoriat", "slug": "eberron/planos/xoriat" }
      ]
    }
  ]
}
