{
  "$schema": "../../../../../../schemas/page.schema.json",
  "slug": "eberron/khorvaire/breland/sharn/barrios/barrios-medios",
  "title": "Barrios Medios",
  "tags": ["Sharn", "Barrios Medios"],
  "aliases": ["Sharn", "Ciudad de las torres", "Barrios Medios"],
  "unlockCondition": null,
  "blocks": [
    {
      "id": "b1",
      "type": "bullet",
      "title": "Puntos de Interés",
      "items": [
        "[[eberron/khorvaire/breland/sharn/barrios/barrios-medios/bazar|El Bazar]]: Bazar blablabla",
        "[[eberron/khorvaire/breland/sharn/barrios/barrios-medios/puerta-muerte|Gremio Puerta de la Muerte]]: Gremio blablabla"
      ]
    },
    {
      "id": "a1",
      "type": "image",
      "src": "/assets/content/eberron/khorvaire/breland/sharn/barrios/barrios-medios/barrios-medios.png",
      "caption": "Barrios Medios",
      "title": "Barrios Medios",
      "align": "center",
      "size": "full",
      "pins": [
        {
          "x": 33.06,
          "y": 37.48,
          "label": "El Bazar",
          "linkSlug": "eberron/khorvaire/breland/sharn/barrios/barrios-medios/bazar"
        },
        {
          "x": 80.65,
          "y": 58.67,
          "label": "Gremio Puerta de la Muerte",
          "linkSlug": "eberron/khorvaire/breland/sharn/barrios/barrios-medios/puerta-muerte"
        },
        {
          "x": 46.98,
          "y": 51.35,
          "label": "Torres Dragón",
          "linkSlug": "eberron/khorvaire/breland/sharn/barrios/barrios-medios/torres-dragon"
        }
      ]
    },
    {
      "id": "a4",
      "type": "related",
      "items": [
        {
          "label": "Mapa de Sharn",
          "slug": "eberron/khorvaire/breland/sharn/barrios"
        },
        {
          "label": "Vía Celestial",
          "slug": "eberron/khorvaire/breland/sharn/barrios/via-celestial"
        },
        {
          "label": "Barrios Altos",
          "slug": "eberron/khorvaire/breland/sharn/barrios/barrios-altos"
        },
        {
          "label": "Barrios Medios",
          "slug": "eberron/khorvaire/breland/sharn/barrios/barrios-medios"
        },
        {
          "label": "Barrios Bajos",
          "slug": "eberron/khorvaire/breland/sharn/barrios/barrios-bajos"
        },
        {
          "label": "Los Engranajes",
          "slug": "eberron/khorvaire/breland/sharn/barrios/engranajes"
        }
      ]
    }
  ]
}
