{
  "$schema": "../../../schemas/page.schema.json",
  "slug": "eberron/planos/shavarath",
  "title": "Shavarath",
  "tags": ["Cosmología", "Planos", "Guerra"],
  "aliases": ["Shavarath", "La contienda eterna"],
  "unlockCondition": null,
  "blocks": [
    {
      "id": "s1",
      "type": "text",
      "content": "Un paisaje plagado de trincheras, fortificaciones, barro y acero. Tres inmensos ejércitos (ángeles de la tiranía, demonios del caos y diablos de la ley) combaten en una batalla eterna que nunca tendrá un ganador. Cuando está coterminal con Khorvaire, las tensiones bélicas del mundo real se disparan."
    },
    {
      "id": "s2",
      "type": "image",
      "src": "/assets/content/eberron/planos/shavarath/shavarath.png",
      "caption": "Shavarath",
      "title": "Shavarath",
      "align": "center",
      "size": "medium"
    },
    {
      "id": "s3",
      "type": "related",
      "items": [
        { "label": "Planos", "slug": "eberron/planos" },
        { "label": "Daanvi", "slug": "eberron/planos/daanvi" },
        { "label": "Dal Quor", "slug": "eberron/planos/dal-quor" },
        { "label": "Dolurrh", "slug": "eberron/planos/dolurrh" },
        { "label": "Fernia", "slug": "eberron/planos/fernia" },
        { "label": "Irian", "slug": "eberron/planos/irian" },
        { "label": "Kythri", "slug": "eberron/planos/kythri" },
        { "label": "Lamannia", "slug": "eberron/planos/lamannia" },
        { "label": "Mabar", "slug": "eberron/planos/mabar" },
        { "label": "Risia", "slug": "eberron/planos/risia" },
        { "label": "Shavarath", "slug": "eberron/planos/shavarath" },
        { "label": "Thelanis", "slug": "eberron/planos/thelanis" },
        { "label": "Xoriat", "slug": "eberron/planos/xoriat" }
      ]
    }
  ]
}
