{
  "$schema": "../../../schemas/page.schema.json",
  "slug": "eberron/planos/kythri",
  "title": "Kythri",
  "tags": ["Cosmología", "Planos", "Caos"],
  "aliases": ["Kythri", "El caos agitado"],
  "unlockCondition": null,
  "blocks": [
    {
      "id": "k1",
      "type": "text",
      "content": "El opuesto absoluto de Daanvi. Un vacío cambiante donde la gravedad cambia de dirección cada segundo, la materia se transmuta de forma aleatoria (el suelo puede convertirse en sopa o en oro) y los slaadi campan a sus anchas. Los viajeros con una voluntad de hierro pueden llegar a moldear el plano temporalmente con su mente."
    },
    {
      "id": "k2",
      "type": "image",
      "src": "/assets/content/eberron/planos/kythri/kythri.png",
      "caption": "Kythri",
      "title": "Kythri",
      "align": "center",
      "size": "medium"
    },
    {
      "id": "k3",
      "type": "related",
      "items": [
        { "label": "Planos", "slug": "eberron/planos" },
        { "label": "Daanvi", "slug": "eberron/planos/daanvi" },
        { "label": "Dal Quor", "slug": "eberron/planos/dal-quor" },
        { "label": "Dolurrh", "slug": "eberron/planos/dolurrh" },
        { "label": "Fernia", "slug": "eberron/planos/fernia" },
        { "label": "Irian", "slug": "eberron/planos/irian" },
        { "label": "Kythri", "slug": "eberron/planos/kythri" },
        { "label": "Lamannia", "slug": "eberron/planos/lamannia" },
        { "label": "Mabar", "slug": "eberron/planos/mabar" },
        { "label": "Risia", "slug": "eberron/planos/risia" },
        { "label": "Shavarath", "slug": "eberron/planos/shavarath" },
        { "label": "Thelanis", "slug": "eberron/planos/thelanis" },
        { "label": "Xoriat", "slug": "eberron/planos/xoriat" }
      ]
    }
  ]
}
