{
  "$schema": "../../../../schemas/page.schema.json",
  "slug": "eberron/sociedad/especies/forjados",
  "title": "Forjados",
  "tags": ["Khorvaire", "Especies", "Forjados"],
  "aliases": ["Forjados", "Constructos"],
  "unlockCondition": null,
  "blocks": [
    {
      "id": "b1",
      "type": "text",
      "title": "Soldados sin Guerra en Busca de un Alma",
      "content": "Constructos vivientes hechos de madera elfa, piedra y metal, creados originalmente por la Casa Cannith como armas vivientes para la Última Guerra. Tras el Tratado de Tronofirme, obtuvieron la libertad y la ciudadanía, pero las factorías donde nacían fueron destruidas. No tienen género, no necesitan comer ni dormir, y ahora vagan por un mundo en paz intentando descubrir quiénes son más allá de ser máquinas de matar."
    },
    {
      "id": "b4",
      "type": "image",
      "src": "/assets/content/eberron/sociedad/especies/forjados/forjados.png",
      "caption": "Forjados",
      "title": "Forjados",
      "align": "center",
      "size": "full"
    },
    {
      "id": "b5",
      "type": "related",
      "items": [
        { "label": "Cambiantes", "slug": "eberron/sociedad/especies/cambiantes" },
        { "label": "Dracónidos", "slug": "eberron/sociedad/especies/draconidos" },
        { "label": "Enanos", "slug": "eberron/sociedad/especies/enanos" },
        { "label": "Elfos", "slug": "eberron/sociedad/especies/elfos" },
        { "label": "Forjados", "slug": "eberron/sociedad/especies/forjados" },
        { "label": "Gnomos", "slug": "eberron/sociedad/especies/gnomos" },
        { "label": "Kalashtar", "slug": "eberron/sociedad/especies/kalashtar" },
        { "label": "Humanos", "slug": "eberron/sociedad/especies/humanos" },
        { "label": "Khoravar", "slug": "eberron/sociedad/especies/khoravar" },
        { "label": "Medianos", "slug": "eberron/sociedad/especies/medianos" },
        { "label": "Monstruos", "slug": "eberron/sociedad/especies/monstruos" },
        { "label": "Orcos", "slug": "eberron/sociedad/especies/orcos" },
        { "label": "Replicantes", "slug": "eberron/sociedad/especies/replicantes" },
        { "label": "Tiflin", "slug": "eberron/sociedad/especies/tiflin" },
        { "label": "Trasgoides", "slug": "eberron/sociedad/especies/trasgoides" },
        { "label": "Goliaths", "slug": "eberron/sociedad/especies/goliaths" }
      ]
    }
  ]
}
