{
  "$schema": "../../../../schemas/page.schema.json",
  "slug": "eberron/vida-en-eberron/especies/kalashtar",
  "title": "Kalashtar",
  "tags": ["Khorvaire", "Especies", "Kalashtar", "Riedra"],
  "aliases": ["Kalashtar"],
  "unlockCondition": null,
  "blocks": [
    {
      "id": "b1",
      "type": "text",
      "title": "Refugiados Psiónicos de la Región de los Sueños",
      "content": "Humanos cuyos linajes se fusionaron voluntariamente con espíritus rebeldes de [[eberron/planos/dalquor|Dal Quor]] (el plano de los sueños). Físicamente son hermosos, estilizados y transmiten una calma sobrenatural. No sueñan como los demás mortales; en su lugar, reviven los recuerdos de sus espíritus simbióticos. Poseen habilidades psiónicas innatas (telepatía) y libran una guerra mental secreta contra el [[eberron/mas-alla/sarlona|Imperio de Riedra]]."
    },
    {
      "id": "b4",
      "type": "image",
      "src": "/assets/content/eberron/vida-en-eberron/especies/kalashtar/kalashtar.png",
      "caption": "Kalashtar",
      "title": "Kalashtar",
      "align": "center",
      "size": "full"
    },
    {
      "id": "b5",
      "type": "related",
      "items": [
        { "label": "Cambiantes", "slug": "eberron/vida-en-eberron/especies/cambiantes" },
        { "label": "Dracónidos", "slug": "eberron/vida-en-eberron/especies/draconidos" },
        { "label": "Enanos", "slug": "eberron/vida-en-eberron/especies/enanos" },
        { "label": "Elfos", "slug": "eberron/vida-en-eberron/especies/elfos" },
        { "label": "Forjados", "slug": "eberron/vida-en-eberron/especies/forjados" },
        { "label": "Gnomos", "slug": "eberron/vida-en-eberron/especies/gnomos" },
        { "label": "Kalashtar", "slug": "eberron/vida-en-eberron/especies/kalashtar" },
        { "label": "Humanos", "slug": "eberron/vida-en-eberron/especies/humanos" },
        { "label": "Khoravar", "slug": "eberron/vida-en-eberron/especies/khoravar" },
        { "label": "Medianos", "slug": "eberron/vida-en-eberron/especies/medianos" },
        { "label": "Monstruos", "slug": "eberron/vida-en-eberron/especies/monstruos" },
        { "label": "Orcos", "slug": "eberron/vida-en-eberron/especies/orcos" },
        { "label": "Replicantes", "slug": "eberron/vida-en-eberron/especies/replicantes" },
        { "label": "Tiflin", "slug": "eberron/vida-en-eberron/especies/tiflin" },
        { "label": "Trasgoides", "slug": "eberron/vida-en-eberron/especies/trasgoides" },
        { "label": "Goliaths", "slug": "eberron/vida-en-eberron/especies/goliaths" }
      ]
    }
  ]
}
