{
  "$schema": "../../../../schemas/page.schema.json",
  "slug": "eberron/vida-en-eberron/especies/cambiantes",
  "title": "Cambiantes",
  "tags": ["Khorvaire", "Especies", "Cambiantes"],
  "aliases": ["Cambiantes", "Licántropos"],
  "unlockCondition": null,
  "blocks": [
    {
      "id": "b1",
      "type": "text",
      "title": "Motores de progreso y ambición",
      "content": "Son la raza más numerosa, adaptable y dominante de Khorvaire. Originarios de [[eberron/mas-alla/sarlona|Riedra]], llegaron a Khorvaire hace 3000 años. Fueron ellos quienes fundaron el Reino de Galifar y quienes desataron la [[eberron/historia/ultima-guerra|Última Guerra]] por ambición dinástica. No tienen una cultura única; un humano de [[eberron/khorvaire/aundair|Aundair]] se siente un mago refinado, mientras que uno de [[eberron/khorvaire/breland|Breland]] es un urbanita industrial. Poseen la mayoría de las [[eberron/casas|Marcas Dragontinas]], lo que los convierte en los líderes del desarrollo tecnológico y comercial del continente."
    },
    {
      "id": "b4",
      "type": "image",
      "src": "/assets/content/eberron/vida-en-eberron/especies/humanos/humanos.png",
      "caption": "Humanos",
      "title": "Humanos",
      "align": "center",
      "size": "full"
    },
    {
      "id": "b5",
      "type": "related",
      "items": [
        { "label": "Cambiantes", "slug": "eberron/vida-en-eberron/especies/cambiantes" },
        { "label": "Dracónidos", "slug": "eberron/vida-en-eberron/especies/draconidos" },
        { "label": "Enanos", "slug": "eberron/vida-en-eberron/especies/enanos" },
        { "label": "Elfos", "slug": "eberron/vida-en-eberron/especies/elfos" },
        { "label": "Forjados", "slug": "eberron/vida-en-eberron/especies/forjados" },
        { "label": "Gnomos", "slug": "eberron/vida-en-eberron/especies/gnomos" },
        { "label": "Kalashtar", "slug": "eberron/vida-en-eberron/especies/kalashtar" },
        { "label": "Humanos", "slug": "eberron/vida-en-eberron/especies/humanos" },
        { "label": "Khoravar", "slug": "eberron/vida-en-eberron/especies/khoravar" },
        { "label": "Medianos", "slug": "eberron/vida-en-eberron/especies/medianos" },
        { "label": "Monstruos", "slug": "eberron/vida-en-eberron/especies/monstruos" },
        { "label": "Orcos", "slug": "eberron/vida-en-eberron/especies/orcos" },
        { "label": "Replicantes", "slug": "eberron/vida-en-eberron/especies/replicantes" },
        { "label": "Tiflin", "slug": "eberron/vida-en-eberron/especies/tiflin" },
        { "label": "Trasgoides", "slug": "eberron/vida-en-eberron/especies/trasgoides" },
        { "label": "Goliaths", "slug": "eberron/vida-en-eberron/especies/goliaths" }
      ]
    }
  ]
}
